{
  "title": "dqn trajectory (extended_kalman_filter)",
  "gridSize": 20,
  "frameDurationMs": 160,
  "wallMode": "wrap",
  "apples": [
    {
      "x": 1,
      "y": 2
    },
    {
      "x": 2,
      "y": 4
    },
    {
      "x": 4,
      "y": 3
    },
    {
      "x": 5,
      "y": 8
    },
    {
      "x": 6,
      "y": 15
    },
    {
      "x": 8,
      "y": 18
    },
    {
      "x": 10,
      "y": 1
    },
    {
      "x": 11,
      "y": 17
    },
    {
      "x": 13,
      "y": 6
    },
    {
      "x": 15,
      "y": 12
    },
    {
      "x": 16,
      "y": 2
    },
    {
      "x": 17,
      "y": 14
    },
    {
      "x": 18,
      "y": 16
    }
  ],
  "frames": [
    {
      "snake": [
        {
          "x": 10,
          "y": 10
        },
        {
          "x": 9,
          "y": 10
        },
        {
          "x": 8,
          "y": 10
        },
        {
          "x": 7,
          "y": 10
        }
      ],
      "eaten": []
    },
    {
      "snake": [
        {
          "x": 11,
          "y": 10
        },
        {
          "x": 10,
          "y": 10
        },
        {
          "x": 9,
          "y": 10
        },
        {
          "x": 8,
          "y": 10
        }
      ],
      "eaten": []
    },
    {
      "snake": [
        {
          "x": 12,
          "y": 10
        },
        {
          "x": 11,
          "y": 10
        },
        {
          "x": 10,
          "y": 10
        },
        {
          "x": 9,
          "y": 10
        }
      ],
      "eaten": []
    },
    {
      "snake": [
        {
          "x": 13,
          "y": 10
        },
        {
          "x": 12,
          "y": 10
        },
        {
          "x": 11,
          "y": 10
        },
        {
          "x": 10,
          "y": 10
        }
      ],
      "eaten": []
    },
    {
      "snake": [
        {
          "x": 14,
          "y": 10
        },
        {
          "x": 13,
          "y": 10
        },
        {
          "x": 12,
          "y": 10
        },
        {
          "x": 11,
          "y": 10
        }
      ],
      "eaten": []
    },
    {
      "snake": [
        {
          "x": 15,
          "y": 10
        },
        {
          "x": 14,
          "y": 10
        },
        {
          "x": 13,
          "y": 10
        },
        {
          "x": 12,
          "y": 10
        }
      ],
      "eaten": []
    },
    {
      "snake": [
        {
          "x": 15,
          "y": 11
        },
        {
          "x": 15,
          "y": 10
        },
        {
          "x": 14,
          "y": 10
        },
        {
          "x": 13,
          "y": 10
        }
      ],
      "eaten": []
    },
    {
      "snake": [
        {
          "x": 15,
          "y": 12
        },
        {
          "x": 15,
          "y": 11
        },
        {
          "x": 15,
          "y": 10
        },
        {
          "x": 14,
          "y": 10
        },
        {
          "x": 13,
          "y": 10
        }
      ],
      "eaten": [
        9
      ]
    },
    {
      "snake": [
        {
          "x": 16,
          "y": 12
        },
        {
          "x": 15,
          "y": 12
        },
        {
          "x": 15,
          "y": 11
        },
        {
          "x": 15,
          "y": 10
        },
        {
          "x": 14,
          "y": 10
        }
      ],
      "eaten": [
        9
      ]
    },
    {
      "snake": [
        {
          "x": 17,
          "y": 12
        },
        {
          "x": 16,
          "y": 12
        },
        {
          "x": 15,
          "y": 12
        },
        {
          "x": 15,
          "y": 11
        },
        {
          "x": 15,
          "y": 10
        }
      ],
      "eaten": [
        9
      ]
    },
    {
      "snake": [
        {
          "x": 17,
          "y": 13
        },
        {
          "x": 17,
          "y": 12
        },
        {
          "x": 16,
          "y": 12
        },
        {
          "x": 15,
          "y": 12
        },
        {
          "x": 15,
          "y": 11
        }
      ],
      "eaten": [
        9
      ]
    },
    {
      "snake": [
        {
          "x": 17,
          "y": 14
        },
        {
          "x": 17,
          "y": 13
        },
        {
          "x": 17,
          "y": 12
        },
        {
          "x": 16,
          "y": 12
        },
        {
          "x": 15,
          "y": 12
        },
        {
          "x": 15,
          "y": 11
        }
      ],
      "eaten": [
        9,
        11
      ]
    },
    {
      "snake": [
        {
          "x": 18,
          "y": 14
        },
        {
          "x": 17,
          "y": 14
        },
        {
          "x": 17,
          "y": 13
        },
        {
          "x": 17,
          "y": 12
        },
        {
          "x": 16,
          "y": 12
        },
        {
          "x": 15,
          "y": 12
        }
      ],
      "eaten": [
        9,
        11
      ]
    },
    {
      "snake": [
        {
          "x": 18,
          "y": 15
        },
        {
          "x": 18,
          "y": 14
        },
        {
          "x": 17,
          "y": 14
        },
        {
          "x": 17,
          "y": 13
        },
        {
          "x": 17,
          "y": 12
        },
        {
          "x": 16,
          "y": 12
        }
      ],
      "eaten": [
        9,
        11
      ]
    },
    {
      "snake": [
        {
          "x": 18,
          "y": 16
        },
        {
          "x": 18,
          "y": 15
        },
        {
          "x": 18,
          "y": 14
        },
        {
          "x": 17,
          "y": 14
        },
        {
          "x": 17,
          "y": 13
        },
        {
          "x": 17,
          "y": 12
        },
        {
          "x": 16,
          "y": 12
        }
      ],
      "eaten": [
        9,
        11,
        12
      ]
    },
    {
      "snake": [
        {
          "x": 17,
          "y": 16
        },
        {
          "x": 18,
          "y": 16
        },
        {
          "x": 18,
          "y": 15
        },
        {
          "x": 18,
          "y": 14
        },
        {
          "x": 17,
          "y": 14
        },
        {
          "x": 17,
          "y": 13
        },
        {
          "x": 17,
          "y": 12
        }
      ],
      "eaten": [
        9,
        11,
        12
      ]
    },
    {
      "snake": [
        {
          "x": 16,
          "y": 16
        },
        {
          "x": 17,
          "y": 16
        },
        {
          "x": 18,
          "y": 16
        },
        {
          "x": 18,
          "y": 15
        },
        {
          "x": 18,
          "y": 14
        },
        {
          "x": 17,
          "y": 14
        },
        {
          "x": 17,
          "y": 13
        }
      ],
      "eaten": [
        9,
        11,
        12
      ]
    },
    {
      "snake": [
        {
          "x": 15,
          "y": 16
        },
        {
          "x": 16,
          "y": 16
        },
        {
          "x": 17,
          "y": 16
        },
        {
          "x": 18,
          "y": 16
        },
        {
          "x": 18,
          "y": 15
        },
        {
          "x": 18,
          "y": 14
        },
        {
          "x": 17,
          "y": 14
        }
      ],
      "eaten": [
        9,
        11,
        12
      ]
    },
    {
      "snake": [
        {
          "x": 14,
          "y": 16
        },
        {
          "x": 15,
          "y": 16
        },
        {
          "x": 16,
          "y": 16
        },
        {
          "x": 17,
          "y": 16
        },
        {
          "x": 18,
          "y": 16
        },
        {
          "x": 18,
          "y": 15
        },
        {
          "x": 18,
          "y": 14
        }
      ],
      "eaten": [
        9,
        11,
        12
      ]
    },
    {
      "snake": [
        {
          "x": 13,
          "y": 16
        },
        {
          "x": 14,
          "y": 16
        },
        {
          "x": 15,
          "y": 16
        },
        {
          "x": 16,
          "y": 16
        },
        {
          "x": 17,
          "y": 16
        },
        {
          "x": 18,
          "y": 16
        },
        {
          "x": 18,
          "y": 15
        }
      ],
      "eaten": [
        9,
        11,
        12
      ]
    },
    {
      "snake": [
        {
          "x": 12,
          "y": 16
        },
        {
          "x": 13,
          "y": 16
        },
        {
          "x": 14,
          "y": 16
        },
        {
          "x": 15,
          "y": 16
        },
        {
          "x": 16,
          "y": 16
        },
        {
          "x": 17,
          "y": 16
        },
        {
          "x": 18,
          "y": 16
        }
      ],
      "eaten": [
        9,
        11,
        12
      ]
    },
    {
      "snake": [
        {
          "x": 11,
          "y": 16
        },
        {
          "x": 12,
          "y": 16
        },
        {
          "x": 13,
          "y": 16
        },
        {
          "x": 14,
          "y": 16
        },
        {
          "x": 15,
          "y": 16
        },
        {
          "x": 16,
          "y": 16
        },
        {
          "x": 17,
          "y": 16
        }
      ],
      "eaten": [
        9,
        11,
        12
      ]
    },
    {
      "snake": [
        {
          "x": 11,
          "y": 17
        },
        {
          "x": 11,
          "y": 16
        },
        {
          "x": 12,
          "y": 16
        },
        {
          "x": 13,
          "y": 16
        },
        {
          "x": 14,
          "y": 16
        },
        {
          "x": 15,
          "y": 16
        },
        {
          "x": 16,
          "y": 16
        },
        {
          "x": 17,
          "y": 16
        }
      ],
      "eaten": [
        7,